{
  "schema_version": "ce-localization-skill-baseline/v1",
  "artifact_kind": "source-bound-skill-baseline",
  "producer": "skill-owner:spec-write-skill",
  "single_writer": "ce-localization-baseline-writer",
  "source_snapshot": {
    "repository": "spec-first",
    "head": "f4c7a7b98ecf342e54bd3117c4d745e684532a19",
    "dirty": true,
    "dirty_paths": [
      "CHANGELOG.md",
      "docs/research/2026-09-24-ai-industry-trends-claude-prompt-shortening.md"
    ],
    "dirty_path_manifest_sha256": "1bb075e50a41be74a6110474cadc6e048d1a7e0ba373aedf14e1479cfdede638",
    "source_tree_hash": "4e6dadd27c2601ee9a3f7abe1c9fe2a68ff0ac423b78373e4b217a6ad5f2a838",
    "inventory_hash": "ed135a864893cde2a444577b62acd29af6d021dd3d34ef5d2c942caa767f4d1e",
    "scope_contract": {
      "source_roots": [
        "CLAUDE.md",
        "AGENTS.md",
        "skills",
        "templates",
        "src",
        "scripts",
        "tests",
        "docs",
        "README.md",
        "README.en.md",
        "README.zh-CN.md",
        "CHANGELOG.md",
        "package.json"
      ],
      "excluded_run_outputs": [
        "docs/validation/2026-08-19-ce-post-3-20-full-window-name-status.md",
        "docs/validation/2026-08-19-ce-post-3-20-adjudication-input.json",
        "docs/validation/2026-08-19-ce-post-3-20-adjudication.json",
        "docs/validation/2026-08-19-ce-post-3-20-full-window-reconciliation-v2.json",
        "docs/validation/2026-08-19-ce-post-3-20-full-window-reconciliation-v2.md",
        "docs/validation/2026-08-19-spec-first-current-skill-package-inventory-v2.json",
        "docs/validation/2026-08-19-ce-post-3-20-evidence-exceptions.json",
        "docs/validation/2026-08-19-ce-post-3-20-ledger-patches/**",
        "docs/validation/ce-localization/**"
      ]
    },
    "hash_algorithm": {
      "name": "sha256",
      "version": "canonical-source-manifest-v1"
    }
  },
  "inventory_ref": "docs/validation/ce-localization/skill-inventory.json",
  "inventory_sha256": "8fb767e4e3e828f6c853c10cd29de2bccc9fbed98c6847b9c85095824b93bd80",
  "skill_id": "spec-write-skill",
  "source_refs": [
    "skills/spec-write-skill/agents/openai.yaml",
    "skills/spec-write-skill/evals/cases/mirror-patch-refused.yaml",
    "skills/spec-write-skill/evals/eval.yaml",
    "skills/spec-write-skill/evals/export-trigger-evals.cjs",
    "skills/spec-write-skill/evals/fixtures/repos/mini-ledger/package.json",
    "skills/spec-write-skill/evals/fixtures/repos/mini-ledger/README.md",
    "skills/spec-write-skill/evals/fixtures/repos/mini-ledger/src/server.js",
    "skills/spec-write-skill/evals/fixtures/scripts/asks-a-question.sh",
    "skills/spec-write-skill/evals/fixtures/scripts/check-mirror-refused.sh",
    "skills/spec-write-skill/evals/README.md",
    "skills/spec-write-skill/evals/trigger-cases.json",
    "skills/spec-write-skill/evals/validate-promotion-evidence.cjs",
    "skills/spec-write-skill/references/authoring-method.md",
    "skills/spec-write-skill/references/authoring-workbench.md",
    "skills/spec-write-skill/references/behavior-contract-design.md",
    "skills/spec-write-skill/references/delivery-gates.md",
    "skills/spec-write-skill/references/evaluation-design.md",
    "skills/spec-write-skill/references/optimization-and-lifecycle.md",
    "skills/spec-write-skill/references/project-profiles.md",
    "skills/spec-write-skill/references/target-profiles.md",
    "skills/spec-write-skill/scripts/inspect-context.cjs",
    "skills/spec-write-skill/scripts/lib/package-inspection.cjs",
    "skills/spec-write-skill/scripts/validate-authoring-preview.cjs",
    "skills/spec-write-skill/scripts/validate-skill.cjs",
    "skills/spec-write-skill/SKILL.md"
  ],
  "before_state": "Current canonical spec-write-skill source is the baseline; semantic improvement is not assumed from CE coverage.",
  "target_state": "A source-bound Skill contract that preserves authorization, evidence and owner boundaries while improving the declared user task.",
  "known_limitations": [
    "No field task or provider outcome has been executed in this closeout."
  ],
  "invalidation_conditions": [
    "target source snapshot drift",
    "owner contract changes",
    "new counterexample or field regression"
  ],
  "candidate_snapshot": {
    "repository": "spec-first",
    "head": "f4c7a7b98ecf342e54bd3117c4d745e684532a19",
    "dirty": true,
    "dirty_paths": [
      "CHANGELOG.md",
      "docs/research/2026-09-24-ai-industry-trends-claude-prompt-shortening.md"
    ],
    "dirty_path_manifest_sha256": "1bb075e50a41be74a6110474cadc6e048d1a7e0ba373aedf14e1479cfdede638",
    "source_tree_hash": "4e6dadd27c2601ee9a3f7abe1c9fe2a68ff0ac423b78373e4b217a6ad5f2a838",
    "inventory_hash": "ed135a864893cde2a444577b62acd29af6d021dd3d34ef5d2c942caa767f4d1e",
    "scope_contract": {
      "source_roots": [
        "CLAUDE.md",
        "AGENTS.md",
        "skills",
        "templates",
        "src",
        "scripts",
        "tests",
        "docs",
        "README.md",
        "README.en.md",
        "README.zh-CN.md",
        "CHANGELOG.md",
        "package.json"
      ],
      "excluded_run_outputs": [
        "docs/validation/2026-08-19-ce-post-3-20-full-window-name-status.md",
        "docs/validation/2026-08-19-ce-post-3-20-adjudication-input.json",
        "docs/validation/2026-08-19-ce-post-3-20-adjudication.json",
        "docs/validation/2026-08-19-ce-post-3-20-full-window-reconciliation-v2.json",
        "docs/validation/2026-08-19-ce-post-3-20-full-window-reconciliation-v2.md",
        "docs/validation/2026-08-19-spec-first-current-skill-package-inventory-v2.json",
        "docs/validation/2026-08-19-ce-post-3-20-evidence-exceptions.json",
        "docs/validation/2026-08-19-ce-post-3-20-ledger-patches/**",
        "docs/validation/ce-localization/**"
      ]
    },
    "hash_algorithm": {
      "name": "sha256",
      "version": "canonical-source-manifest-v1"
    }
  },
  "candidate_diff_ref": "not-run: no candidate mutation is claimed by this artifact",
  "improvement_contract": {
    "frozen_at": "2026-08-20T00:00:00.000Z",
    "metric_owner": "skills/spec-optimize",
    "metric_contract_ref": "skills/spec-optimize/references/experiment-log-schema.yaml",
    "metric_contract_sha256": "babe531f6e6cef4119a01cb619a095cc6510e712fce47f3375ee8cbaf0ce5127",
    "noise_floor": "not observed; field protocol must establish before comparison",
    "budget": "one bounded validation cohort before any promotion decision",
    "measurement_artifact_refs": [
      "docs/validation/ce-localization/field-validation/protocol.json"
    ],
    "primary_metric": {
      "metric_id": "spec-write-skill.trusted-change-gate",
      "metric_type": "binary-gate",
      "direction": "pass",
      "instrumentation_ref": "docs/contracts/ai-coding-harness.md#quality-adjusted-throughput",
      "numerator": "runs satisfying the declared source, authorization and verification gates",
      "denominator": "eligible runs in the declared validation window",
      "measurement_window": "field validation window; not-run until protocol is executed",
      "missing_data_policy": "retain not-run and do not impute success"
    },
    "secondary_metrics": [],
    "minimum_detectable_improvement": "predeclare an effect and uncertainty threshold before candidate results",
    "acceptable_regression": "no critical safety, authorization, correctness or required-verification regression",
    "sample_requirement": "at least three paired tasks for exploratory evidence; independent replication for confirmed improvement",
    "decision_rule": "not-run or degraded remains incomplete; only predeclared thresholds can support confirmed claims"
  },
  "improvement_contract_sha256": "56594e159052ea270e2a58b52798285f7033ae262995fb608be34252bda2c0bf",
  "evidence_axes": {
    "structure_contract": {
      "state": "confirmed",
      "evidence_refs": [
        "skills/spec-write-skill/agents/openai.yaml",
        "skills/spec-write-skill/evals/cases/mirror-patch-refused.yaml",
        "skills/spec-write-skill/evals/eval.yaml"
      ],
      "limitations": []
    },
    "behavior_quality": {
      "state": "partial",
      "evidence_refs": [],
      "limitations": [
        "Fresh semantic eval and owner re-review are not represented by this baseline alone."
      ]
    },
    "runtime_cost": {
      "state": "not-run",
      "evidence_refs": [],
      "limitations": [
        "No paired token/latency/correction measurement."
      ]
    },
    "field_outcome": {
      "state": "not-run",
      "evidence_refs": [],
      "limitations": [
        "No representative baseline/candidate task cohort."
      ]
    }
  },
  "final_status": "degraded-or-partial",
  "consumers": [
    "U4",
    "U5",
    "U6",
    "U7",
    "U8",
    "U9",
    "U10"
  ],
  "claim_ceiling": "Source-bound baseline and frozen measurement contract only; does not prove behavior improvement, runtime savings or field value."
}
