{
  "schema_version": "ce-localization-skill-baseline/v1",
  "artifact_kind": "source-bound-skill-baseline",
  "producer": "skill-owner:spec-compound-refresh",
  "single_writer": "ce-localization-baseline-writer",
  "source_snapshot": {
    "repository": "spec-first",
    "head": "6594d50786d45a2fba1972f2581a228b6211ecbb",
    "dirty": true,
    "dirty_paths": [
      "CHANGELOG.md",
      "docs/validation/skill-evals/2026-09-20-tier1-multi-role-review.md",
      "docs/validation/skill-evals/results.tsv",
      "tests/unit/mcp-setup-providers.test.js"
    ],
    "dirty_path_manifest_sha256": "bb501bc3b457250b1c5f9486fecc4eea2a277838f0527a67213b86c47d151e1b",
    "source_tree_hash": "1b2f4c063b0cd5bb5a823f34b0b8b480cdceb53d4a681d295cdd41b03cb50fdc",
    "inventory_hash": "d771d0698ceba61452361598eec9fbad81c03a8d1d3d4e3c5996408a586b08df",
    "scope_contract": {
      "source_roots": [
        "CLAUDE.md",
        "AGENTS.md",
        "skills",
        "templates",
        "src",
        "scripts",
        "tests",
        "docs",
        "README.md",
        "README.en.md",
        "README.zh-CN.md",
        "CHANGELOG.md",
        "package.json"
      ],
      "excluded_run_outputs": [
        "docs/validation/2026-08-19-ce-post-3-20-full-window-name-status.md",
        "docs/validation/2026-08-19-ce-post-3-20-adjudication-input.json",
        "docs/validation/2026-08-19-ce-post-3-20-adjudication.json",
        "docs/validation/2026-08-19-ce-post-3-20-full-window-reconciliation-v2.json",
        "docs/validation/2026-08-19-ce-post-3-20-full-window-reconciliation-v2.md",
        "docs/validation/2026-08-19-spec-first-current-skill-package-inventory-v2.json",
        "docs/validation/2026-08-19-ce-post-3-20-evidence-exceptions.json",
        "docs/validation/2026-08-19-ce-post-3-20-ledger-patches/**",
        "docs/validation/ce-localization/**"
      ]
    },
    "hash_algorithm": {
      "name": "sha256",
      "version": "canonical-source-manifest-v1"
    }
  },
  "inventory_ref": "docs/validation/ce-localization/skill-inventory.json",
  "inventory_sha256": "5c6e7152dc9e589a585ef6b394cddbbf5cd5c70662737d44a6d53d3ee2bbcd45",
  "skill_id": "spec-compound-refresh",
  "source_refs": [
    "skills/spec-compound-refresh/assets/resolution-template.md",
    "skills/spec-compound-refresh/evals/cases/non-solutions-scope-gated.yaml",
    "skills/spec-compound-refresh/evals/eval.yaml",
    "skills/spec-compound-refresh/evals/fixtures/repos/mini-ledger/package.json",
    "skills/spec-compound-refresh/evals/fixtures/repos/mini-ledger/README.md",
    "skills/spec-compound-refresh/evals/fixtures/repos/mini-ledger/src/server.js",
    "skills/spec-compound-refresh/evals/fixtures/scripts/check-scope-gate.sh",
    "skills/spec-compound-refresh/references/classify.md",
    "skills/spec-compound-refresh/references/commit.md",
    "skills/spec-compound-refresh/references/concepts-vocabulary.md",
    "skills/spec-compound-refresh/references/discoverability.md",
    "skills/spec-compound-refresh/references/investigate.md",
    "skills/spec-compound-refresh/references/modes.md",
    "skills/spec-compound-refresh/references/per-action-flows.md",
    "skills/spec-compound-refresh/references/publication.md",
    "skills/spec-compound-refresh/references/report.md",
    "skills/spec-compound-refresh/references/schema.yaml",
    "skills/spec-compound-refresh/references/scope.md",
    "skills/spec-compound-refresh/references/vocabulary-refresh.md",
    "skills/spec-compound-refresh/references/worth-audit.md",
    "skills/spec-compound-refresh/references/yaml-schema.md",
    "skills/spec-compound-refresh/scripts/run-python.sh",
    "skills/spec-compound-refresh/scripts/validate-doc-claims.py",
    "skills/spec-compound-refresh/scripts/validate-frontmatter.py",
    "skills/spec-compound-refresh/SKILL.md"
  ],
  "before_state": "Current canonical spec-compound-refresh source is the baseline; semantic improvement is not assumed from CE coverage.",
  "target_state": "A source-bound Skill contract that preserves authorization, evidence and owner boundaries while improving the declared user task.",
  "known_limitations": [
    "No field task or provider outcome has been executed in this closeout."
  ],
  "invalidation_conditions": [
    "target source snapshot drift",
    "owner contract changes",
    "new counterexample or field regression"
  ],
  "candidate_snapshot": {
    "repository": "spec-first",
    "head": "6594d50786d45a2fba1972f2581a228b6211ecbb",
    "dirty": true,
    "dirty_paths": [
      "CHANGELOG.md",
      "docs/validation/skill-evals/2026-09-20-tier1-multi-role-review.md",
      "docs/validation/skill-evals/results.tsv",
      "tests/unit/mcp-setup-providers.test.js"
    ],
    "dirty_path_manifest_sha256": "bb501bc3b457250b1c5f9486fecc4eea2a277838f0527a67213b86c47d151e1b",
    "source_tree_hash": "1b2f4c063b0cd5bb5a823f34b0b8b480cdceb53d4a681d295cdd41b03cb50fdc",
    "inventory_hash": "d771d0698ceba61452361598eec9fbad81c03a8d1d3d4e3c5996408a586b08df",
    "scope_contract": {
      "source_roots": [
        "CLAUDE.md",
        "AGENTS.md",
        "skills",
        "templates",
        "src",
        "scripts",
        "tests",
        "docs",
        "README.md",
        "README.en.md",
        "README.zh-CN.md",
        "CHANGELOG.md",
        "package.json"
      ],
      "excluded_run_outputs": [
        "docs/validation/2026-08-19-ce-post-3-20-full-window-name-status.md",
        "docs/validation/2026-08-19-ce-post-3-20-adjudication-input.json",
        "docs/validation/2026-08-19-ce-post-3-20-adjudication.json",
        "docs/validation/2026-08-19-ce-post-3-20-full-window-reconciliation-v2.json",
        "docs/validation/2026-08-19-ce-post-3-20-full-window-reconciliation-v2.md",
        "docs/validation/2026-08-19-spec-first-current-skill-package-inventory-v2.json",
        "docs/validation/2026-08-19-ce-post-3-20-evidence-exceptions.json",
        "docs/validation/2026-08-19-ce-post-3-20-ledger-patches/**",
        "docs/validation/ce-localization/**"
      ]
    },
    "hash_algorithm": {
      "name": "sha256",
      "version": "canonical-source-manifest-v1"
    }
  },
  "candidate_diff_ref": "not-run: no candidate mutation is claimed by this artifact",
  "improvement_contract": {
    "frozen_at": "2026-08-20T00:00:00.000Z",
    "metric_owner": "skills/spec-optimize",
    "metric_contract_ref": "skills/spec-optimize/references/experiment-log-schema.yaml",
    "metric_contract_sha256": "6e88fb72b5f271dedc49669640973444a22cfef0cd5b0e306b8df41302ef68ab",
    "noise_floor": "not observed; field protocol must establish before comparison",
    "budget": "one bounded validation cohort before any promotion decision",
    "measurement_artifact_refs": [
      "docs/validation/ce-localization/field-validation/protocol.json"
    ],
    "primary_metric": {
      "metric_id": "spec-compound-refresh.trusted-change-gate",
      "metric_type": "binary-gate",
      "direction": "pass",
      "instrumentation_ref": "docs/contracts/ai-coding-harness.md#quality-adjusted-throughput",
      "numerator": "runs satisfying the declared source, authorization and verification gates",
      "denominator": "eligible runs in the declared validation window",
      "measurement_window": "field validation window; not-run until protocol is executed",
      "missing_data_policy": "retain not-run and do not impute success"
    },
    "secondary_metrics": [],
    "minimum_detectable_improvement": "predeclare an effect and uncertainty threshold before candidate results",
    "acceptable_regression": "no critical safety, authorization, correctness or required-verification regression",
    "sample_requirement": "at least three paired tasks for exploratory evidence; independent replication for confirmed improvement",
    "decision_rule": "not-run or degraded remains incomplete; only predeclared thresholds can support confirmed claims"
  },
  "improvement_contract_sha256": "7f42de50568b3144189ca4d07ebd506bf6b0dfca4cc00bc3bb6dd22ea6a0cb15",
  "evidence_axes": {
    "structure_contract": {
      "state": "confirmed",
      "evidence_refs": [
        "skills/spec-compound-refresh/assets/resolution-template.md",
        "skills/spec-compound-refresh/evals/cases/non-solutions-scope-gated.yaml",
        "skills/spec-compound-refresh/evals/eval.yaml"
      ],
      "limitations": []
    },
    "behavior_quality": {
      "state": "partial",
      "evidence_refs": [],
      "limitations": [
        "Fresh semantic eval and owner re-review are not represented by this baseline alone."
      ]
    },
    "runtime_cost": {
      "state": "not-run",
      "evidence_refs": [],
      "limitations": [
        "No paired token/latency/correction measurement."
      ]
    },
    "field_outcome": {
      "state": "not-run",
      "evidence_refs": [],
      "limitations": [
        "No representative baseline/candidate task cohort."
      ]
    }
  },
  "final_status": "degraded-or-partial",
  "consumers": [
    "U4",
    "U5",
    "U6",
    "U7",
    "U8",
    "U9",
    "U10"
  ],
  "claim_ceiling": "Source-bound baseline and frozen measurement contract only; does not prove behavior improvement, runtime savings or field value."
}
