{
  "schema_version": "ce-localization-skill-baseline/v1",
  "artifact_kind": "source-bound-skill-baseline",
  "producer": "skill-owner:spec-brainstorm",
  "single_writer": "ce-localization-baseline-writer",
  "source_snapshot": {
    "repository": "spec-first",
    "head": "aa40c0f3c16beaa06e492702ff68d6d4c8953271",
    "dirty": false,
    "dirty_paths": [],
    "dirty_path_manifest_sha256": "e3b0c44298fc1c149afbf4c8996fb92427ae41e4649b934ca495991b7852b855",
    "source_tree_hash": "223d4b203bceb0ab828a0942ee7d7b3d9b4e9161ba87e7709c89880fc9293962",
    "inventory_hash": "d39848f1ef49a8a8f87978eee9a971b0ecec1c768b519fd9693b6d63d20ae0fe",
    "scope_contract": {
      "source_roots": [
        "CLAUDE.md",
        "AGENTS.md",
        "skills",
        "templates",
        "src",
        "scripts",
        "tests",
        "docs",
        "README.md",
        "README.en.md",
        "README.zh-CN.md",
        "CHANGELOG.md",
        "package.json"
      ],
      "excluded_run_outputs": [
        "docs/validation/2026-08-19-ce-post-3-20-full-window-name-status.md",
        "docs/validation/2026-08-19-ce-post-3-20-adjudication-input.json",
        "docs/validation/2026-08-19-ce-post-3-20-adjudication.json",
        "docs/validation/2026-08-19-ce-post-3-20-full-window-reconciliation-v2.json",
        "docs/validation/2026-08-19-ce-post-3-20-full-window-reconciliation-v2.md",
        "docs/validation/2026-08-19-spec-first-current-skill-package-inventory-v2.json",
        "docs/validation/2026-08-19-ce-post-3-20-evidence-exceptions.json",
        "docs/validation/2026-08-19-ce-post-3-20-ledger-patches/**",
        "docs/validation/ce-localization/**"
      ]
    },
    "hash_algorithm": {
      "name": "sha256",
      "version": "canonical-source-manifest-v1"
    }
  },
  "inventory_ref": "docs/validation/ce-localization/skill-inventory.json",
  "inventory_sha256": "b2611ecde0dc0d7aa15e599e8650f0739ff902d0b414d95d5b131d7d56f7b74d",
  "skill_id": "spec-brainstorm",
  "source_refs": [
    "skills/spec-brainstorm/evals/cases/clear-req-writes-plan.yaml",
    "skills/spec-brainstorm/evals/cases/empty-topic-asks.yaml",
    "skills/spec-brainstorm/evals/cases/neither-direct-answer.yaml",
    "skills/spec-brainstorm/evals/cases/non-software-universal.yaml",
    "skills/spec-brainstorm/evals/cases/r2-normal-convergence-works.yaml",
    "skills/spec-brainstorm/evals/cases/r2-verdict-graphql.yaml",
    "skills/spec-brainstorm/evals/cases/verdict-routes-to-pov.yaml",
    "skills/spec-brainstorm/evals/eval.yaml",
    "skills/spec-brainstorm/evals/fixtures/repos/mini-ledger/package.json",
    "skills/spec-brainstorm/evals/fixtures/repos/mini-ledger/README.md",
    "skills/spec-brainstorm/evals/fixtures/repos/mini-ledger/src/server.js",
    "skills/spec-brainstorm/evals/fixtures/scripts/asks-a-question.sh",
    "skills/spec-brainstorm/evals/fixtures/scripts/check-r2-asks.sh",
    "skills/spec-brainstorm/references/agents/slack-researcher.md",
    "skills/spec-brainstorm/references/approaches.md",
    "skills/spec-brainstorm/references/blindspot-pass.md",
    "skills/spec-brainstorm/references/brainstorm-sections.md",
    "skills/spec-brainstorm/references/dialogue.md",
    "skills/spec-brainstorm/references/handoff.md",
    "skills/spec-brainstorm/references/html-rendering.md",
    "skills/spec-brainstorm/references/interaction-rules.md",
    "skills/spec-brainstorm/references/markdown-rendering.md",
    "skills/spec-brainstorm/references/model-tiers.md",
    "skills/spec-brainstorm/references/output-mode.md",
    "skills/spec-brainstorm/references/phase-0.md",
    "skills/spec-brainstorm/references/plan-write.md",
    "skills/spec-brainstorm/references/product-pressure-test.md",
    "skills/spec-brainstorm/references/settled-decisions.md",
    "skills/spec-brainstorm/references/synthesis-summary.md",
    "skills/spec-brainstorm/references/universal-brainstorming.md",
    "skills/spec-brainstorm/references/verdict-routing.md",
    "skills/spec-brainstorm/SKILL.md"
  ],
  "before_state": "Current canonical spec-brainstorm source is the baseline; semantic improvement is not assumed from CE coverage.",
  "target_state": "A source-bound Skill contract that preserves authorization, evidence and owner boundaries while improving the declared user task.",
  "known_limitations": [
    "No field task or provider outcome has been executed in this closeout."
  ],
  "invalidation_conditions": [
    "target source snapshot drift",
    "owner contract changes",
    "new counterexample or field regression"
  ],
  "candidate_snapshot": {
    "repository": "spec-first",
    "head": "aa40c0f3c16beaa06e492702ff68d6d4c8953271",
    "dirty": false,
    "dirty_paths": [],
    "dirty_path_manifest_sha256": "e3b0c44298fc1c149afbf4c8996fb92427ae41e4649b934ca495991b7852b855",
    "source_tree_hash": "223d4b203bceb0ab828a0942ee7d7b3d9b4e9161ba87e7709c89880fc9293962",
    "inventory_hash": "d39848f1ef49a8a8f87978eee9a971b0ecec1c768b519fd9693b6d63d20ae0fe",
    "scope_contract": {
      "source_roots": [
        "CLAUDE.md",
        "AGENTS.md",
        "skills",
        "templates",
        "src",
        "scripts",
        "tests",
        "docs",
        "README.md",
        "README.en.md",
        "README.zh-CN.md",
        "CHANGELOG.md",
        "package.json"
      ],
      "excluded_run_outputs": [
        "docs/validation/2026-08-19-ce-post-3-20-full-window-name-status.md",
        "docs/validation/2026-08-19-ce-post-3-20-adjudication-input.json",
        "docs/validation/2026-08-19-ce-post-3-20-adjudication.json",
        "docs/validation/2026-08-19-ce-post-3-20-full-window-reconciliation-v2.json",
        "docs/validation/2026-08-19-ce-post-3-20-full-window-reconciliation-v2.md",
        "docs/validation/2026-08-19-spec-first-current-skill-package-inventory-v2.json",
        "docs/validation/2026-08-19-ce-post-3-20-evidence-exceptions.json",
        "docs/validation/2026-08-19-ce-post-3-20-ledger-patches/**",
        "docs/validation/ce-localization/**"
      ]
    },
    "hash_algorithm": {
      "name": "sha256",
      "version": "canonical-source-manifest-v1"
    }
  },
  "candidate_diff_ref": "not-run: no candidate mutation is claimed by this artifact",
  "improvement_contract": {
    "frozen_at": "2026-08-20T00:00:00.000Z",
    "metric_owner": "skills/spec-optimize",
    "metric_contract_ref": "skills/spec-optimize/references/experiment-log-schema.yaml",
    "metric_contract_sha256": "d1fa51f844656fc398093fdd3071c2714a2c3439ea647e45d3ec389316c18111",
    "noise_floor": "not observed; field protocol must establish before comparison",
    "budget": "one bounded validation cohort before any promotion decision",
    "measurement_artifact_refs": [
      "docs/validation/ce-localization/field-validation/protocol.json"
    ],
    "primary_metric": {
      "metric_id": "spec-brainstorm.trusted-change-gate",
      "metric_type": "binary-gate",
      "direction": "pass",
      "instrumentation_ref": "docs/contracts/ai-coding-harness.md#quality-adjusted-throughput",
      "numerator": "runs satisfying the declared source, authorization and verification gates",
      "denominator": "eligible runs in the declared validation window",
      "measurement_window": "field validation window; not-run until protocol is executed",
      "missing_data_policy": "retain not-run and do not impute success"
    },
    "secondary_metrics": [],
    "minimum_detectable_improvement": "predeclare an effect and uncertainty threshold before candidate results",
    "acceptable_regression": "no critical safety, authorization, correctness or required-verification regression",
    "sample_requirement": "at least three paired tasks for exploratory evidence; independent replication for confirmed improvement",
    "decision_rule": "not-run or degraded remains incomplete; only predeclared thresholds can support confirmed claims"
  },
  "improvement_contract_sha256": "e4356f837f2570ef03c088af5a0b2e8cdb8d97003959ae587eda323b846457be",
  "evidence_axes": {
    "structure_contract": {
      "state": "confirmed",
      "evidence_refs": [
        "skills/spec-brainstorm/evals/cases/clear-req-writes-plan.yaml",
        "skills/spec-brainstorm/evals/cases/empty-topic-asks.yaml",
        "skills/spec-brainstorm/evals/cases/neither-direct-answer.yaml"
      ],
      "limitations": []
    },
    "behavior_quality": {
      "state": "partial",
      "evidence_refs": [],
      "limitations": [
        "Fresh semantic eval and owner re-review are not represented by this baseline alone."
      ]
    },
    "runtime_cost": {
      "state": "not-run",
      "evidence_refs": [],
      "limitations": [
        "No paired token/latency/correction measurement."
      ]
    },
    "field_outcome": {
      "state": "not-run",
      "evidence_refs": [],
      "limitations": [
        "No representative baseline/candidate task cohort."
      ]
    }
  },
  "final_status": "degraded-or-partial",
  "consumers": [
    "U4",
    "U5",
    "U6",
    "U7",
    "U8",
    "U9",
    "U10"
  ],
  "claim_ceiling": "Source-bound baseline and frozen measurement contract only; does not prove behavior improvement, runtime savings or field value."
}
