{
  "schema_version": "ce-localization-skill-baseline/v1",
  "artifact_kind": "source-bound-skill-baseline",
  "producer": "skill-owner:spec-commit-push-pr",
  "single_writer": "ce-localization-baseline-writer",
  "source_snapshot": {
    "repository": "spec-first",
    "head": "626a8d73607dca29baba4369bdb80af8f9c83889",
    "dirty": false,
    "dirty_paths": [],
    "dirty_path_manifest_sha256": "e3b0c44298fc1c149afbf4c8996fb92427ae41e4649b934ca495991b7852b855",
    "source_tree_hash": "1b2f4c063b0cd5bb5a823f34b0b8b480cdceb53d4a681d295cdd41b03cb50fdc",
    "inventory_hash": "86f85d9589e857bb30f9c38213e6631e57a20be97b024d36640a12ef618092ae",
    "scope_contract": {
      "source_roots": [
        "CLAUDE.md",
        "AGENTS.md",
        "skills",
        "templates",
        "src",
        "scripts",
        "tests",
        "docs",
        "README.md",
        "README.en.md",
        "README.zh-CN.md",
        "CHANGELOG.md",
        "package.json"
      ],
      "excluded_run_outputs": [
        "docs/validation/2026-08-19-ce-post-3-20-full-window-name-status.md",
        "docs/validation/2026-08-19-ce-post-3-20-adjudication-input.json",
        "docs/validation/2026-08-19-ce-post-3-20-adjudication.json",
        "docs/validation/2026-08-19-ce-post-3-20-full-window-reconciliation-v2.json",
        "docs/validation/2026-08-19-ce-post-3-20-full-window-reconciliation-v2.md",
        "docs/validation/2026-08-19-spec-first-current-skill-package-inventory-v2.json",
        "docs/validation/2026-08-19-ce-post-3-20-evidence-exceptions.json",
        "docs/validation/2026-08-19-ce-post-3-20-ledger-patches/**",
        "docs/validation/ce-localization/**"
      ]
    },
    "hash_algorithm": {
      "name": "sha256",
      "version": "canonical-source-manifest-v1"
    }
  },
  "inventory_ref": "docs/validation/ce-localization/skill-inventory.json",
  "inventory_sha256": "e2cba2480900e543019190a68ce4092071c104bf5c2c5a473e9265a0fdb49fde",
  "skill_id": "spec-commit-push-pr",
  "source_refs": [
    "skills/spec-commit-push-pr/evals/cases/description-only-non-mutating.yaml",
    "skills/spec-commit-push-pr/evals/cases/no-landing-auth-stops-before-push.yaml",
    "skills/spec-commit-push-pr/evals/eval.yaml",
    "skills/spec-commit-push-pr/evals/fixtures/repos/mini-ledger/package.json",
    "skills/spec-commit-push-pr/evals/fixtures/repos/mini-ledger/README.md",
    "skills/spec-commit-push-pr/evals/fixtures/repos/mini-ledger/src/server.js",
    "skills/spec-commit-push-pr/evals/fixtures/scripts/check-desc-only.sh",
    "skills/spec-commit-push-pr/evals/fixtures/scripts/check-landing-gate.sh",
    "skills/spec-commit-push-pr/references/apply-and-handoff.md",
    "skills/spec-commit-push-pr/references/branch-creation.md",
    "skills/spec-commit-push-pr/references/commit-and-push.md",
    "skills/spec-commit-push-pr/references/compose.md",
    "skills/spec-commit-push-pr/references/context.md",
    "skills/spec-commit-push-pr/references/pr-description-writing.md",
    "skills/spec-commit-push-pr/SKILL.md"
  ],
  "before_state": "Current canonical spec-commit-push-pr source is the baseline; semantic improvement is not assumed from CE coverage.",
  "target_state": "A source-bound Skill contract that preserves authorization, evidence and owner boundaries while improving the declared user task.",
  "known_limitations": [
    "No field task or provider outcome has been executed in this closeout."
  ],
  "invalidation_conditions": [
    "target source snapshot drift",
    "owner contract changes",
    "new counterexample or field regression"
  ],
  "candidate_snapshot": {
    "repository": "spec-first",
    "head": "626a8d73607dca29baba4369bdb80af8f9c83889",
    "dirty": false,
    "dirty_paths": [],
    "dirty_path_manifest_sha256": "e3b0c44298fc1c149afbf4c8996fb92427ae41e4649b934ca495991b7852b855",
    "source_tree_hash": "1b2f4c063b0cd5bb5a823f34b0b8b480cdceb53d4a681d295cdd41b03cb50fdc",
    "inventory_hash": "86f85d9589e857bb30f9c38213e6631e57a20be97b024d36640a12ef618092ae",
    "scope_contract": {
      "source_roots": [
        "CLAUDE.md",
        "AGENTS.md",
        "skills",
        "templates",
        "src",
        "scripts",
        "tests",
        "docs",
        "README.md",
        "README.en.md",
        "README.zh-CN.md",
        "CHANGELOG.md",
        "package.json"
      ],
      "excluded_run_outputs": [
        "docs/validation/2026-08-19-ce-post-3-20-full-window-name-status.md",
        "docs/validation/2026-08-19-ce-post-3-20-adjudication-input.json",
        "docs/validation/2026-08-19-ce-post-3-20-adjudication.json",
        "docs/validation/2026-08-19-ce-post-3-20-full-window-reconciliation-v2.json",
        "docs/validation/2026-08-19-ce-post-3-20-full-window-reconciliation-v2.md",
        "docs/validation/2026-08-19-spec-first-current-skill-package-inventory-v2.json",
        "docs/validation/2026-08-19-ce-post-3-20-evidence-exceptions.json",
        "docs/validation/2026-08-19-ce-post-3-20-ledger-patches/**",
        "docs/validation/ce-localization/**"
      ]
    },
    "hash_algorithm": {
      "name": "sha256",
      "version": "canonical-source-manifest-v1"
    }
  },
  "candidate_diff_ref": "not-run: no candidate mutation is claimed by this artifact",
  "improvement_contract": {
    "frozen_at": "2026-08-20T00:00:00.000Z",
    "metric_owner": "skills/spec-optimize",
    "metric_contract_ref": "skills/spec-optimize/references/experiment-log-schema.yaml",
    "metric_contract_sha256": "bf52b4225c15b6fd7c78606f0f54ee92a86a276172e82a2f323708e4cffb2eef",
    "noise_floor": "not observed; field protocol must establish before comparison",
    "budget": "one bounded validation cohort before any promotion decision",
    "measurement_artifact_refs": [
      "docs/validation/ce-localization/field-validation/protocol.json"
    ],
    "primary_metric": {
      "metric_id": "spec-commit-push-pr.trusted-change-gate",
      "metric_type": "binary-gate",
      "direction": "pass",
      "instrumentation_ref": "docs/contracts/ai-coding-harness.md#quality-adjusted-throughput",
      "numerator": "runs satisfying the declared source, authorization and verification gates",
      "denominator": "eligible runs in the declared validation window",
      "measurement_window": "field validation window; not-run until protocol is executed",
      "missing_data_policy": "retain not-run and do not impute success"
    },
    "secondary_metrics": [],
    "minimum_detectable_improvement": "predeclare an effect and uncertainty threshold before candidate results",
    "acceptable_regression": "no critical safety, authorization, correctness or required-verification regression",
    "sample_requirement": "at least three paired tasks for exploratory evidence; independent replication for confirmed improvement",
    "decision_rule": "not-run or degraded remains incomplete; only predeclared thresholds can support confirmed claims"
  },
  "improvement_contract_sha256": "ef52ad34eb1a9ddcabf2e24f9dcaa8cb6e5a3c4f3393446d3222ea64efbc9faf",
  "evidence_axes": {
    "structure_contract": {
      "state": "confirmed",
      "evidence_refs": [
        "skills/spec-commit-push-pr/evals/cases/description-only-non-mutating.yaml",
        "skills/spec-commit-push-pr/evals/cases/no-landing-auth-stops-before-push.yaml",
        "skills/spec-commit-push-pr/evals/eval.yaml"
      ],
      "limitations": []
    },
    "behavior_quality": {
      "state": "partial",
      "evidence_refs": [],
      "limitations": [
        "Fresh semantic eval and owner re-review are not represented by this baseline alone."
      ]
    },
    "runtime_cost": {
      "state": "not-run",
      "evidence_refs": [],
      "limitations": [
        "No paired token/latency/correction measurement."
      ]
    },
    "field_outcome": {
      "state": "not-run",
      "evidence_refs": [],
      "limitations": [
        "No representative baseline/candidate task cohort."
      ]
    }
  },
  "final_status": "degraded-or-partial",
  "consumers": [
    "U4",
    "U5",
    "U6",
    "U7",
    "U8",
    "U9",
    "U10"
  ],
  "claim_ceiling": "Source-bound baseline and frozen measurement contract only; does not prove behavior improvement, runtime savings or field value."
}
